id,name,location,elevation_meters,duration_minutes,distance_km,difficulty,category,description,image_url,review_count,duration_label
1,Aiguille du Midi,"Chamonix, France",3842,630,28.0,EXPERT,MOUNTAIN,"Experience one of the most breathtaking adventures in the French Alps as you hike toward the iconic Aiguille du Midi. Located in Chamonix, France, this trail offers unparalleled views of the surrounding peaks, glaciers, and the majestic Mont Blanc — the highest point in Western Europe.",https://images.unsplash.com/photo-1464822759023-fed622ff2c3b?w=800&q=80,124,10-12h
2,Lac Blanc,"Chamonix, France",2352,300,12.5,INTERMEDIATE,LAKE,"A classic Chamonix hike with stunning views of the Mont Blanc massif reflected in the crystal-clear alpine lake. The trail winds through alpine meadows and offers exceptional panoramas.",https://images.unsplash.com/photo-1501854140801-50d01698950b?w=800&q=80,89,5-6h
3,Mer de Glace,"Chamonix, France",1913,180,8.0,BEGINNER,MOUNTAIN,"An accessible hike leading to France's largest glacier. A magical journey through ancient ice formations carved over thousands of years.",https://images.unsplash.com/photo-1519681393784-d120267933ba?w=800&q=80,203,3h
4,Grand Balcon Nord,"Chamonix, France",2400,360,15.0,INTERMEDIATE,MOUNTAIN,"A spectacular ridge trail running along the north side of the Chamonix valley with breathtaking views of Mont Blanc and the Aiguilles Rouges.",https://images.unsplash.com/photo-1486870591958-9b9d0d1dda99?w=800&q=80,67,6-7h
5,Forêt de Bénévise,"Servoz, France",1200,150,7.5,BEGINNER,FOREST,"A peaceful forest walk through ancient pine and fir trees. Perfect for beginners and families, with natural wildlife and serene atmosphere.",https://images.unsplash.com/photo-1448375240586-882707db888b?w=800&q=80,41,2-3h
6,Lac Cornu,"Les Houches, France",2114,240,10.0,INTERMEDIATE,LAKE,"A hidden gem tucked between granite peaks, Lac Cornu rewards hikers with turquoise waters and complete solitude far from the crowds.",https://images.unsplash.com/photo-1476514525535-07fb3b4ae5f1?w=800&q=80,28,4-5h
